<?xml version="1.0" encoding="UTF-8"?>
<CypDhl xmlns="invDHL" xmlns:xsi="http://www.w3.org/2001/XMLSchema-instance" xsi:schemaLocation="invDHL DhlInvoices.xsd"><Hdr xmlns=""><Origin>From DHL Cyprus</Origin><FileCreationDate>2017-08-01</FileCreationDate><FileName>C:\Data\DelphiProjects\Tariffs\InvoiceXML\dhlCypInv_1_1_20170801111653.XML</FileName></Hdr><Invoices xmlns=""><Invoice><SerialNumber>1</SerialNumber><HawbId>2011452074</HawbId><MawbId>61591381611</MawbId><District></District><InvoiceDate>2017-07-30</InvoiceDate><Amount>   0.00 </Amount><Customer><Name>DROUSKO HOUSE AGENCIES LTD</Name><Address><Address1></Address1><PostCode></PostCode><City></City><Country></Country></Address></Customer><Lines><Line><Amount>   0.00 </Amount><Category>GVAT</Category></Line></Lines></Invoice></Invoices></CypDhl>
