<?xml version="1.0" encoding="UTF-8"?>
<CypDhl xmlns="invDHL" xmlns:xsi="http://www.w3.org/2001/XMLSchema-instance" xsi:schemaLocation="invDHL DhlInvoices.xsd"><Hdr><Origin>From DHL Cyprus</Origin><FileCreationDate>2017-08-01</FileCreationDate><FileName>C:\Data\DelphiProjects\Tariffs\InvoiceXML\dhlCypInv_2_2_20170801112502.XML</FileName></Hdr><Invoices><Invoice><SerialNumber>2</SerialNumber><HawbId>2370129075</HawbId><MawbId>61591381611</MawbId><District>LAR</District><InvoiceDate>2017-07-30</InvoiceDate><Amount>   3.50 </Amount><Customer><Name> ANDREAS   ACHILLEOS</Name><Address><Address1>7 AGIOU THERAPONTOS</Address1><PostCode>NICOSIA </PostCode><City>CYPRUS</City><Country>CYPRUS</Country></Address></Customer><Lines><Line><Amount>   3.50 </Amount><Category>GCUS</Category></Line><Line><Amount>   0.00 </Amount><Category>GDHL</Category></Line><Line><Amount>   0.00 </Amount><Category>GVAT</Category></Line></Lines></Invoice></Invoices></CypDhl>
