<?xml version="1.0" encoding="UTF-8"?>
<CypDhl xmlns="invDHL" xmlns:xsi="http://www.w3.org/2001/XMLSchema-instance" xsi:schemaLocation="invDHL DhlInvoices.xsd"><Hdr xmlns=""><Origin>From DHL Cyprus</Origin><FileCreationDate>2017-08-01</FileCreationDate><FileName>C:\Data\DelphiProjects\Tariffs\InvoiceXML\dhlCypInv_3_4_20170801095553.XML</FileName></Hdr><Invoices xmlns=""><Invoice><SerialNumber>3</SerialNumber><HawbId>2532919185</HawbId><MawbId>61591381611</MawbId><District>NIC</District><InvoiceDate>2017-07-30</InvoiceDate><Amount>   3.50 </Amount><Customer><Name>UDJAT EYE FASHIONS LTD</Name><Address><Address1>NICOSIA</Address1><PostCode></PostCode><City></City><Country>CYPRUS</Country></Address></Customer><Lines><Line><Amount>   3.50 </Amount><Category>GCUS</Category></Line><Line><Amount>   0.00 </Amount><Category>GDHL</Category></Line><Line><Amount>   0.00 </Amount><Category>GVAT</Category></Line></Lines></Invoice><Invoice><SerialNumber>4</SerialNumber><HawbId>2819013945</HawbId><MawbId>61591381611</MawbId><District>NIC</District><InvoiceDate>2017-07-30</InvoiceDate><Amount>  17.00 </Amount><Customer><Name>THE  ENGLISH  SCHOOL</Name><Address><Address1>NICOSIA</Address1><PostCode></PostCode><City></City><Country>CYPRUS</Country></Address></Customer><Lines><Line><Amount>   2.00 </Amount><Category>GCUS</Category></Line><Line><Amount>  15.00 </Amount><Category>GVAT</Category></Line></Lines></Invoice></Invoices></CypDhl>
